{
  "plan_id": "plan_001",
  "source_instruction": "fleet_1 前出至 target_A 区域侦察敌方目标，fleet_2 前往 target_B 区域待机，发现敌方主群后由 fleet_2 执行拦截。",
  "standard_task_plan_text": "fleet_1 前出至 target_A 区域执行侦察任务，确认敌方主群位置；fleet_2 进入 target_B 区域待机；当 fleet_1 发现并确认敌方主群后，fleet_2 对敌方主群执行拦截任务。",
  "scenario_id": "scenario_simple",
  "participants": [
    {
      "actor_id": "fleet_1",
      "type": "fleet",
      "role": "recon",
      "capability_ref": "fleet_1"
    },
    {
      "actor_id": "fleet_2",
      "type": "fleet",
      "role": "strike",
      "capability_ref": "fleet_2"
    }
  ],
  "tasks": [
    {
      "task_id": "T1",
      "actor": "fleet_1",
      "action": "reconnaissance",
      "target": "target_A",
      "condition": "mission_start",
      "time_window": null,
      "expected_output": "enemy_main_group_location_confirmed",
      "is_coalition": false,
      "coalition_members": null
    },
    {
      "task_id": "T2",
      "actor": "fleet_2",
      "action": "standby",
      "target": "target_B",
      "condition": "mission_start",
      "time_window": null,
      "expected_output": "fleet_2_ready_at_target_B",
      "is_coalition": false,
      "coalition_members": null
    },
    {
      "task_id": "T3",
      "actor": "fleet_2",
      "action": "intercept",
      "target": "enemy_main_group",
      "condition": "enemy_main_group_location_confirmed",
      "time_window": null,
      "expected_output": "enemy_main_group_intercepted",
      "is_coalition": false,
      "coalition_members": null
    }
  ],
  "relations": [
    {
      "source": "T1",
      "target": "T3",
      "type": "condition_trigger",
      "sync_tolerance": null,
      "condition": "enemy_main_group_location_confirmed"
    },
    {
      "source": "T2",
      "target": "T3",
      "type": "sequence",
      "sync_tolerance": null,
      "condition": "fleet_2_ready_at_target_B"
    }
  ],
  "global_constraints": {
    "total_time_budget": null,
    "rendezvous_points": []
  },
  "ambiguities": [],
  "missing_fields": [],
  "parse_confidence": 0.95
}